{
  "levelId": "trade_secrets_level_1",
  "realmId": "trade_secrets",
  "levelNumber": 1,
  "name": "Understanding Trade Secrets",
  "difficulty": "Basic",
  "xpReward": 100,
  "estimatedMinutes": 8,
  "videoUrl": "dQw4w9WgXcQ",
  "videoDuration": 300,
  "contentBlocks": [
    {
      "type": "text",
      "content": "A trade secret is confidential business information that provides a company with a competitive advantage. Unlike patents, trademarks, or copyrights, trade secrets are not registered with any government authority and remain protected as long as they are kept secret."
    },
    {
      "type": "text",
      "content": "Trade secrets can include formulas, practices, processes, designs, instruments, patterns, or compilations of information. The key requirement is that the information must be secret, have commercial value because it is secret, and be subject to reasonable steps to keep it secret."
    },
    {
      "type": "image",
      "content": "https://via.placeholder.com/400x300/F59E0B/FFFFFF?text=Trade+Secret",
      "caption": "Trade secrets are protected through confidentiality"
    },
    {
      "type": "example",
      "content": "The Coca-Cola formula is one of the world's most famous trade secrets. The company has kept the recipe confidential for over 130 years, storing it in a secure vault. By maintaining it as a trade secret rather than patenting it, Coca-Cola has indefinite protection as long as the formula remains secret.",
      "metadata": {
        "title": "Coca-Cola Formula Trade Secret"
      }
    },
    {
      "type": "text",
      "content": "Trade secrets offer several advantages: they don't require registration, they can last indefinitely, and there are no maintenance fees. However, if the secret is discovered independently or through reverse engineering, the protection is lost."
    },
    {
      "type": "text",
      "content": "Companies protect trade secrets through non-disclosure agreements (NDAs), employee confidentiality agreements, restricted access to information, and security measures. Employees who have access to trade secrets have a legal duty not to disclose them."
    },
    {
      "type": "case_study",
      "content": "A software company developed a unique algorithm for data compression. Instead of patenting it (which would require public disclosure), they kept it as a trade secret. They used NDAs with employees and contractors, restricted code access, and implemented security measures. This allowed them to maintain their competitive advantage indefinitely.",
      "metadata": {
        "title": "Software Algorithm Trade Secret"
      }
    },
    {
      "type": "text",
      "content": "In India, trade secrets are protected through common law and contractual obligations. The Indian Contract Act, 1872, and various court decisions provide the legal framework for trade secret protection."
    }
  ],
  "keyTakeaways": [
    "Trade secrets are confidential business information providing competitive advantage",
    "Protection lasts as long as the information remains secret",
    "No registration is required for trade secret protection",
    "Companies use NDAs and security measures to protect trade secrets",
    "If discovered independently, trade secret protection is lost"
  ],
  "quizQuestions": [
    {
      "question": "What is a trade secret?",
      "options": [
        "A registered patent",
        "Confidential business information providing competitive advantage",
        "A public trademark",
        "A copyrighted work"
      ],
      "correctIndex": 1,
      "explanation": "A trade secret is confidential business information that provides a company with a competitive advantage and is protected through secrecy rather than registration."
    },
    {
      "question": "How long does trade secret protection last?",
      "options": [
        "10 years",
        "20 years",
        "As long as it remains secret",
        "Lifetime of creator"
      ],
      "correctIndex": 2,
      "explanation": "Trade secret protection lasts indefinitely, as long as the information remains secret and continues to provide competitive advantage."
    },
    {
      "question": "What is required to maintain trade secret protection?",
      "options": [
        "Annual registration fees",
        "Public disclosure",
        "Reasonable steps to keep the information secret",
        "Patent filing"
      ],
      "correctIndex": 2,
      "explanation": "To maintain trade secret protection, companies must take reasonable steps to keep the information secret, such as using NDAs, security measures, and restricted access."
    },
    {
      "question": "Which is a famous example of a trade secret?",
      "options": [
        "The Nike logo",
        "The Coca-Cola formula",
        "The iPhone design",
        "Microsoft Windows"
      ],
      "correctIndex": 1,
      "explanation": "The Coca-Cola formula is one of the world's most famous trade secrets, kept confidential for over 130 years."
    },
    {
      "question": "What happens if a trade secret is discovered through reverse engineering?",
      "options": [
        "The discoverer is sued automatically",
        "Protection is lost",
        "Protection continues",
        "The company gets a patent"
      ],
      "correctIndex": 1,
      "explanation": "If a trade secret is discovered independently or through legitimate reverse engineering, the protection is lost because the information is no longer secret."
    }
  ],
  "passingScore": 60,
  "version": "1.0.0",
  "updatedAt": "2025-01-15T00:00:00Z"
}
