{
  "levelId": "copyright_level_1",
  "realmId": "copyright",
  "levelNumber": 1,
  "name": "What is Copyright?",
  "difficulty": "Basic",
  "xpReward": 100,
  "estimatedMinutes": 8,
  "videoUrl": "dQw4w9WgXcQ",
  "videoDuration": 300,
  "contentBlocks": [
    {
      "type": "text",
      "content": "Copyright is a legal right that grants the creator of an original work exclusive rights to its use and distribution. This protection is automatic and begins the moment a work is created and fixed in a tangible form."
    },
    {
      "type": "text",
      "content": "Copyright protects various forms of creative expression including literary works, musical compositions, dramatic works, artistic works, cinematographic films, and sound recordings. It gives creators control over how their work is used, reproduced, and distributed."
    },
    {
      "type": "image",
      "content": "https://via.placeholder.com/400x300/6366F1/FFFFFF?text=Copyright+Symbol",
      "caption": "The copyright symbol © indicates protected work"
    },
    {
      "type": "example",
      "content": "When an author writes a book, they automatically own the copyright to that book. This means no one else can publish, reproduce, or distribute the book without the author's permission. The author can choose to sell these rights, license them, or keep them exclusively.",
      "metadata": {
        "title": "Book Copyright Example"
      }
    },
    {
      "type": "text",
      "content": "In India, copyright protection lasts for the lifetime of the creator plus 60 years after their death. For cinematographic films, sound recordings, photographs, and posthumous publications, the protection lasts for 60 years from the date of publication."
    },
    {
      "type": "case_study",
      "content": "A famous Indian case involved the unauthorized reproduction of a popular Bollywood film. The court ruled in favor of the copyright holder, emphasizing that copyright protection is essential for encouraging creativity and protecting the economic interests of creators.",
      "metadata": {
        "title": "Bollywood Film Copyright Case"
      }
    },
    {
      "type": "summary",
      "content": "Copyright is an automatic legal protection for original creative works. It grants creators exclusive rights to use, reproduce, and distribute their work. In India, this protection typically lasts for the creator's lifetime plus 60 years."
    }
  ],
  "keyTakeaways": [
    "Copyright protects original creative works automatically upon creation",
    "Protection covers literary, musical, dramatic, artistic, and cinematographic works",
    "Copyright gives creators exclusive rights to use and distribute their work",
    "In India, copyright lasts for the creator's lifetime plus 60 years",
    "No registration is required for copyright protection to begin"
  ],
  "quizQuestions": [
    {
      "question": "What does copyright protect?",
      "options": [
        "Original creative works",
        "Ideas and concepts",
        "Facts and data",
        "Product names and logos"
      ],
      "correctIndex": 0,
      "explanation": "Copyright protects original creative works that are fixed in a tangible form. It does not protect ideas, facts, or names - those may be protected by other forms of intellectual property law."
    },
    {
      "question": "When does copyright protection begin?",
      "options": [
        "After registering with the copyright office",
        "Automatically when the work is created",
        "After publishing the work",
        "After paying a registration fee"
      ],
      "correctIndex": 1,
      "explanation": "Copyright protection begins automatically the moment an original work is created and fixed in a tangible form. Registration is optional and provides additional legal benefits, but is not required for protection."
    },
    {
      "question": "How long does copyright protection last in India for most works?",
      "options": [
        "50 years from creation",
        "Lifetime of creator only",
        "Lifetime of creator plus 60 years",
        "Forever"
      ],
      "correctIndex": 2,
      "explanation": "In India, copyright protection for most works lasts for the lifetime of the creator plus 60 years after their death. This ensures creators and their heirs can benefit from their work while eventually allowing it to enter the public domain."
    },
    {
      "question": "Which of the following is NOT protected by copyright?",
      "options": [
        "A novel",
        "A painting",
        "A song",
        "A mathematical formula"
      ],
      "correctIndex": 3,
      "explanation": "Mathematical formulas, scientific principles, and facts are not protected by copyright because they are discoveries rather than creative expressions. However, the way these are explained or presented in a book or article can be copyrighted."
    },
    {
      "question": "What symbol is commonly used to indicate copyrighted work?",
      "options": [
        "™",
        "®",
        "©",
        "℗"
      ],
      "correctIndex": 2,
      "explanation": "The © symbol is used to indicate copyrighted work. While not required for protection, it serves as a notice to others that the work is protected and identifies the copyright owner and year of first publication."
    }
  ],
  "passingScore": 60,
  "version": "1.0.0",
  "updatedAt": "2025-01-15T00:00:00Z"
}
