{
  "levelId": "copyright_level_2",
  "realmId": "copyright",
  "levelNumber": 2,
  "name": "Types of Copyright",
  "difficulty": "Basic",
  "xpReward": 100,
  "estimatedMinutes": 10,
  "videoUrl": "dQw4w9WgXcQ",
  "videoDuration": 360,
  "contentBlocks": [
    {
      "type": "text",
      "content": "Copyright law protects various types of creative works. Understanding these categories helps creators know what protection they have and what rights they can exercise."
    },
    {
      "type": "text",
      "content": "Literary Works: This includes books, articles, poems, computer programs, and any written material. The protection covers the expression of ideas, not the ideas themselves."
    },
    {
      "type": "example",
      "content": "A software developer writes code for a mobile application. The code itself is protected as a literary work under copyright law, preventing others from copying or distributing it without permission.",
      "metadata": {
        "title": "Software Copyright Example"
      }
    },
    {
      "type": "text",
      "content": "Musical Works: Songs, compositions, and musical scores are protected. This includes both the melody and lyrics. Recording rights are separate from composition rights."
    },
    {
      "type": "text",
      "content": "Dramatic Works: Plays, scripts, screenplays, and choreographic works fall under this category. The dramatic presentation and dialogue are protected."
    },
    {
      "type": "text",
      "content": "Artistic Works: Paintings, drawings, sculptures, photographs, and architectural designs are protected as artistic works. The visual expression is what receives protection."
    },
    {
      "type": "text",
      "content": "Cinematographic Films: Movies, documentaries, and video content are protected. This includes the visual recording and any accompanying soundtrack."
    },
    {
      "type": "text",
      "content": "Sound Recordings: The actual recording of sounds, whether music, speech, or other sounds, is protected separately from the underlying work being recorded."
    }
  ],
  "keyTakeaways": [
    "Literary works include books, articles, and computer programs",
    "Musical works protect both melody and lyrics",
    "Dramatic works cover plays, scripts, and choreography",
    "Artistic works include paintings, photographs, and sculptures",
    "Cinematographic films and sound recordings have separate protections"
  ],
  "quizQuestions": [
    {
      "question": "Which type of work includes computer programs?",
      "options": [
        "Literary works",
        "Artistic works",
        "Musical works",
        "Dramatic works"
      ],
      "correctIndex": 0,
      "explanation": "Computer programs are classified as literary works under copyright law because they consist of written code and instructions, similar to written text."
    },
    {
      "question": "What does copyright protect in a song?",
      "options": [
        "Only the lyrics",
        "Only the melody",
        "Both melody and lyrics",
        "Only the recording"
      ],
      "correctIndex": 2,
      "explanation": "Copyright protects both the melody and lyrics of a song as a musical work. The recording of the song is protected separately as a sound recording."
    },
    {
      "question": "Which category would a movie script fall under?",
      "options": [
        "Literary works",
        "Dramatic works",
        "Cinematographic films",
        "Artistic works"
      ],
      "correctIndex": 1,
      "explanation": "A movie script is classified as a dramatic work because it contains dialogue, stage directions, and dramatic presentation elements."
    },
    {
      "question": "Are photographs protected by copyright?",
      "options": [
        "No, they are not creative enough",
        "Yes, as artistic works",
        "Only professional photographs",
        "Only if registered"
      ],
      "correctIndex": 1,
      "explanation": "Photographs are protected as artistic works under copyright law. The photographer's creative choices in composition, lighting, and timing make photographs eligible for protection."
    },
    {
      "question": "What is the difference between a musical work and a sound recording?",
      "options": [
        "There is no difference",
        "Musical work is the composition, sound recording is the actual recording",
        "Sound recording is more protected",
        "Musical work only applies to classical music"
      ],
      "correctIndex": 1,
      "explanation": "A musical work refers to the composition (melody and lyrics), while a sound recording refers to the actual recorded performance. Both have separate copyright protections."
    }
  ],
  "passingScore": 60,
  "version": "1.0.0",
  "updatedAt": "2025-01-15T00:00:00Z"
}
